{
  "name": "code-review",
  "version": "2.163.0",
  "description": "Phase 0 トリアージ + 動的エージェント構成のコードレビュー。confidence × severity の 2 軸で報告閾値を制御し、diff の性質と effort に応じて explorer → reviewer → 反証レイヤーを構成する。PR レビュー（/review）とコミット前セルフレビュー（/self-review。--embed で他プラグインから委譲可）に対応。",
  "author": {
    "name": "yuki"
  },
  "_requirements": [
    {
      "name": "github",
      "type": "mcp_server",
      "required": true,
      "description": "GitHub MCP サーバー"
    },
    {
      "name": "jq",
      "type": "cli_tool",
      "required": true,
      "description": "JSON プロセッサ。fetch-pr-context.sh が PR 会話コンテキストの整形に使用（必須パス）"
    },
    {
      "name": "python3",
      "type": "cli_tool",
      "required": true,
      "description": "payload の整形・検証（publish-review-event.sh）とトークン集計（measure-tokens.sh）で使用"
    },
    {
      "name": "kvault",
      "type": "cli_tool",
      "required": false,
      "description": "knowledge vault CLI。self-review Step 1.5 / review Step 2.6 の Vault 照合で使用（MCP ツール search_knowledge があればそちらを優先）、どちらも無ければ skip（後方互換）"
    },
    {
      "name": "writing-polish",
      "type": "plugin",
      "required": false,
      "description": "review 締めフロー 3 の投稿コメントドラフト推敲と、self-review の Markdown 推敲（diff の md の散文を --embed で通し before→after を別枠に出す）。インストール時のみ soft 委譲し、未導入時は skip（dormant・後方互換）"
    },
    {
      "name": "dev-workflow",
      "type": "plugin",
      "required": false,
      "description": "self-review Step 8 の worktree 後片付けで worktree-teardown を起動（レビュー完了後の作業用 worktree 破棄）。未インストール時は silent skip"
    }
  ],
  "userConfig": {
    "review_confidence_threshold": {
      "title": "Review Confidence Threshold",
      "description": "CRITICAL severity 以下の最低 confidence スコア (デフォルト: 80、後方互換のため残置)",
      "type": "number",
      "sensitive": false
    },
    "review_severity_threshold": {
      "title": "Review Severity Threshold",
      "description": "報告対象の最低 severity (BLOCKER / CRITICAL / MAJOR / MINOR。未設定時は review が MAJOR・self-review が MINOR)",
      "type": "string",
      "sensitive": false
    },
    "enable_adaptive_rounds": {
      "title": "Enable Adaptive Deepening Round",
      "description": "reviewer の unmet_information をトリガーに Round 2（high: reviewer 再起動の 1 段圧縮 / xhigh・max: 追加 explorer 2 段）を実行するか (デフォルト: true)。false にするとトークンコストとレイテンシを抑制",
      "type": "boolean",
      "sensitive": false
    },
    "enable_meta_reviewer": {
      "title": "Enable Meta-reviewer Round",
      "description": "BLOCKER / CRITICAL 検出時、または報告見込みの MAJOR が 3 件以上のときに meta-reviewer ラウンドを実行するか (デフォルト: true、effort xhigh/max のみ動作)",
      "type": "boolean",
      "sensitive": false
    },
    "enable_adversarial_verify": {
      "title": "Enable Adversarial Verification Layer",
      "description": "reviewer の指摘を独立エージェントが反証する反証レイヤー (Phase 5.9/4.9) を実行するか (デフォルト: true、effort high 以上で動作)。高 severity は消さず係争注記、MAJOR以下のみ取り下げ。false にするとトークンコストを抑制",
      "type": "boolean",
      "sensitive": false
    },
    "enable_recall_skeptic": {
      "title": "Enable Cold-read Skeptic Round",
      "description": "high-risk surface (DB 書込 / 金銭・数量 / 認可) を含む変更で findings 非注入の独立 skeptic を 1 体起動し fleet 共通盲点を破る recall 補強レイヤー (Phase 5.8/4.8) を実行するか (デフォルト: true、effort xhigh/max で動作)。false にすると high-risk surface でも起動せずトークンコストを抑制 (surface-aware 報告閾値は別機構で無効化されない)",
      "type": "boolean",
      "sensitive": false
    }
  },
  "types": "./types/index.d.ts"
}
