{
  "name": "doc-freshness",
  "version": "0.5.4",
  "description": "ドキュメント鮮度の機械強制。last-validated / phase frontmatter による stale 検出、行数ガード、internal link 検証、新規 doc grace period 対応。.claude/adr・.claude/designs・.claude/living-specs も走査し append_only: true で append-only 履歴文書の stale 判定を免除。PostToolUse hook で frontmatter 欠落を非ブロッキング検知、SessionStart hook（opt-in）で stale を一括通知",
  "author": {
    "name": "yuki"
  }
}
