{
  "name": "dev-workflow",
  "version": "1.39.1",
  "description": "Git 操作・PR 作成・UI 動作確認・バグ診断・worktree 並列環境セットアップの開発ワークフロー。原子性重視のコミット、承認ゲート付き PR 作成、chrome-devtools MCP による UI 自動化、feedback loop 駆動の 6 Phase バグ診断、worktree 単位の DB / port 分離を提供する。",
  "author": {
    "name": "yuki"
  },
  "types": "./types/index.d.ts",
  "userConfig": {
    "commit_language": {
      "title": "Commit Language",
      "description": "コミットメッセージの言語 (ja/en)",
      "type": "string",
      "required": false,
      "default": "ja"
    },
    "browser_connect": {
      "title": "UI 動作確認のブラウザ接続方式",
      "description": "ui-verify が認証あり画面を E2E するときの chrome-devtools 接続方式。default=専用プロファイル / autoConnect=実 Chrome のログイン状態を再利用（Chrome 144+） / userDataDir=<path>=指定プロファイル。launcher が .claude/dev-workflow.json の browser_connect も参照する（userConfig 到達経路が未確定なため。設計 open 1）",
      "type": "string",
      "required": false,
      "default": "default"
    },
    "worktree_gc_root": {
      "title": "worktree-gc の --all 走査 root",
      "description": "worktree-gc を --all で起動したときに find する root。scan.sh は環境変数 DEV_WORKFLOW_WORKTREE_GC_ROOT → .claude/dev-workflow.json の worktree_gc_root → $HOME の順で読む（userConfig 到達経路が未確定なため browser_connect と同じ fallback 構成）",
      "type": "string",
      "required": false,
      "default": ""
    }
  },
  "_requirements": [
    {
      "name": "gh",
      "type": "cli_tool",
      "required": true,
      "description": "GitHub CLI"
    },
    {
      "name": "linear",
      "type": "mcp_server",
      "required": false,
      "description": "Linear MCP サーバー（PR に Issue リンク付与時に使用）"
    },
    {
      "name": "chrome-devtools",
      "type": "mcp_server",
      "required": false,
      "description": "chrome-devtools MCP（ui-verify スキルで使用、.mcp.json で同梱配布）"
    },
    {
      "name": "node",
      "type": "cli_tool",
      "required": false,
      "description": "chrome-devtools-mcp を npx 起動するため（ui-verify 利用時）"
    },
    {
      "name": "writing-polish",
      "type": "plugin",
      "required": false,
      "description": "PR 本文・コミットメッセージを提示前に推敲（pr-creator / git-commit-helper で --embed 連携、未インストール時は skip）"
    }
  ]
}
