{
  "name": "writing-polish",
  "version": "0.10.2",
  "description": "文章を語句レベルで推敲・添削する。最小差分の diff 提示 → 採否フローで、冗長削り・曖昧語の具体化・トーン統一・AI っぽさ除去を行う。過剰修正の抑制を中核原則に置き、textlint があれば日本語の決定的チェックを併用する（日英対応）。散文とコードコメントを自動判別し、--embed で他プラグインから委譲できる。",
  "author": {
    "name": "yuki"
  },
  "_requirements": [
    {
      "name": "textlint",
      "type": "cli_tool",
      "required": false,
      "description": "日本語文章の決定的チェック（表記・文法・冗長構文・しきい値）に使用。未導入時はユーザー確認の上 LLM 判定にフォールバックするため必須ではない。SessionStart の check-deps が本体の有無に加えて同梱 textlintrc のルール解決可否を検査する。導入: npm i -g textlint textlint-rule-preset-ja-technical-writing textlint-rule-ja-no-redundant-expression @textlint-ja/textlint-rule-preset-ai-writing textlint-rule-preset-ai-words-ja（mise 環境は install 後に mise reshim が要る場合あり）"
    }
  ]
}
