{
  "name": "project-hub",
  "version": "0.1.1",
  "description": "1 つのセッションを hub にして、複数の作業セッションで進める PJ の状態（作業セッション・PR・Issue・確かめた事実）をコンテキストの外のファイルで持つ。作業側の report はファイルで受け、hub からの連絡は送る直前に宛先を引き直す。hub のセッションにだけ SessionStart / PostCompact で状態の表を注入する",
  "author": {
    "name": "yuki"
  },
  "_requirements": [
    {
      "name": "python3",
      "type": "cli_tool",
      "required": true,
      "description": "状態ファイルの読み書き・宛先の照合（scripts/hub.py）と注入 hook で使用"
    },
    {
      "name": "gh",
      "type": "cli_tool",
      "required": false,
      "description": "GitHub の Issue・PR の取得（hub status。tracker が github のとき）。無ければその source を取得失敗として残す"
    },
    {
      "name": "linear",
      "type": "mcp_server",
      "required": false,
      "description": "Linear の Issue の取得（hub status。tracker が linear のとき）。無ければその source を取得失敗として残す"
    }
  ]
}
